afraid	alive	angry	confused	depressed	envious	happy	helpless	hurt	indifferent	interested	judgemental	loving	open	peaceful	sad	strong
Plisse les yeux	Demande-leur : "Qu'est le pire qui puisse arriver ?"	Crie !	Pose une question	Abandonne	Réfléchis à la façon dont leur vie est meilleure que la tienne	Souris	Abandonne	Dis-leur "Quoi ?"	Réessaie	Pose une question de suivi	Plisse les yeux	Souris avec les yeux	Regarde-les dans les yeux	Plisse les yeux, regarde légèrement vers le haut à ta droite	Soupire	Attends
Évite le contact visuel	Dis-leur d'aller prendre un autre verre	Partage tes frustrations	Répète ce qu'ils viennent de te dire	Ferme les yeux	Admire-les	Souris et dis merci	Regarde le sol	Fixe le vide	Hausse les épaules	Penche-toi en avant	Recule	Demande-leur s'ils ont tout ce dont ils ont besoin	Respire	Plisse les yeux et acquiesce lentement	Pleure silencieusement une perte	Partage ton opinion
Tape des doigts sur ta cuisse	Imagine que tu connais un secret qui te fait réaliser que tout va bien se passer Pense à ce secret et fais un signe de tête	Compatis	Répète ce qu'ils viennent de dire	Regarde vers le bas	Imagine comment ta vie serait plus facile si tu étais eux	Établis un contact visuel	Cesse d'essayer	Regarde-les comme si tu pouvais voir leur bouche bouger mais que tu ne comprends pas ce qu'ils disent	Ignore-les	Acquiesce de manière encourageante	Secoue la tête	Dis-leur que tu es là pour eux	Détends tes épaules	Demande-leur s'ils pensent qu'il y a une autre façon	Mentionne quelque chose qui te manque	Reste fidèle à tes croyances
Vite ! Souris pour qu'ils ne remarquent pas que tu es sur eux	Demande-leur s'ils veulent aller à Disneyland avec toi	Élève la voix	Oublie	Soupire	Écarquille tes yeux	Maintiens leur regard	Demande "Quel est l'intérêt ?"	Regarde-les avec un visage vide et secoue lentement la tête	Écoute à moitié ce qu'ils disent	Dis "dis-moi davantage"	Critique	Demande-leur ce dont ils ont besoin	Écoute	Dis-leur que tu es ouvert à d'autres solutions	Abandonne-toi à la mélancolie	Tiens ta position
Ouvre la bouche pour dire quelque chose, puis referme-la	Dis-leur : "Bien sûr ! Je prendrai un autre verre !"	Critique	Change de sujet	Ignore ce qu'ils disent	Regarde ailleurs	Acquiesce en signe d'accord	Regarde vers le bas	Ouvre la bouche comme si tu allais dire quelque chose	Rêvasse	Pose des questions	Pointe du doigt les problèmes	Souris avec les yeux et acquiesce	Demande-leur d'approfondir	Dis : "Huh Je n'ai jamais pensé à ça de cette façon"	Affaisse tes épaules	Acquiesce de manière décontractée
Jette un coup d'œil par-dessus ton épaule	Dis-leur que personne n'est vraiment aux commandes ici, donc toutes les idées sont sur la table	Garde rancune	Désaccorde-toi	Hausse les épaules	Parle de ce que tu veux	Augmente ton énergie	S'agite	Lève-toi et fixe le vide	Regarde les murs	Regarde-les attentivement	Contredis	Souris sans montrer tes dents	Dis "dis-moi en davantage"	Respire profondément	Parle doucement	Incline-toi en arrière
Tu sais que leurs intentions ne sont pas bonnes, mais dis-leur merci d'être si gentils	Inspire profondément	Provoque-les	Change d'avis	Enveloppe tes bras autour de toi	Imagine comment les choses pourraient être différentes	Approuve ce qu'ils disent	Avoir un regard vide	Protège-toi	Tape tes doigts ensemble tout en comptant	Observe	Ignore ce qu'ils disent	Regarde-les profondément dans les yeux	Pose des questions	Réfléchis à ce qui va bien en ce moment	Baisse ta voix	Lâche prise des soucis
Détourne le regard	Parle légèrement plus fort que d'habitude	Désaccorde-toi catégoriquement	Es-tu sûr ? Essaye de reconsiderer	Fixe le lointain	Souhaite	Rappelle la meilleure chose qui soit arrivée cette semaine	Respire rapidement	Balance-toi d'avant en arrière	Laisse tomber	Fais attention	Réitère	Émane de la chaleur	Réfléchis à ce qu'ils disent	Lâche prise	Évoque un ami d'autrefois	Pense à toutes les tâches que tu as cochées sur ta liste de choses à faire la semaine dernière
Quel est le pire qui pourrait arriver ? Imagine cela	Remarque ton environnement	Réfute	Dis la première chose qui te vient à l'esprit	Ignore	Rêve	Sois chaleureux·se	Rejette les réconforts	Enveloppe tes bras autour de toi	Fais un signe de tête	Considère comment ils se sentent	Secoue la tête d'incrédulité	Tiens-les tout près	Considère ton contexte	Répète une phrase apaisante pour toi-même	Replie-toi sur toi-même	Persévère
Indulge tes inquiétudes	Fais attention à ton odeur	Ignore ce qu'ils disent	Regarde dans l'autre direction	Désengage-toi	Désire	Fais une blague	Lâche prise	Considère où tu ressens actuellement de la douleur dans ton corps	Compte les taches sur le mur	Imagine que tu es eux	Demande plus	Invite-les	Penche-toi en avant	Sois d'accord avec eux	Regarde vers le bas	Continue d'avancer
Partage ta peur	Regarde-les de près	Signale les problèmes	Demande "Pourquoi ?"	Oublie	Parle de tes désirs	Ris ensemble	Affaisse-toi sur ton siège	Laisse la douleur irradier	Regarde au-delà d'eux	Établis un contact visuel	Regarde au-delà d'eux	Félicite-les	Ouvre davantage tes yeux	Recentre-toi	Partage un moment de tristesse	Lâche prise des peurs
Jette un coup d'œil autour de toi pour rester vigilant	Émerveille-toi	Contredis	Regarde-les d'un air perplexe	Baisse la voix	Autorise-toi tes fantasmes	Rebondis sur ton siège	Pense à toutes les fois où tu n'as pas pu faire assez	Résiste	Rêvasse	Demande "Comment est-ce que cela te fait sentir ?"	Soupire	Complimente-les	Détends ta posture	Invite-les	Souviens-toi	Va là où tu n'es jamais allé(e) auparavant
Ne baisse pas ta garde	Pose une question de suivi	Exprime ton insatisfaction à leur égard	Lève les sourcils	Retire-toi en toi-même	Rêve éveillé d'être quelqu'un d'autre	Balance-toi avec la musique	Parle des choses que tu ne peux pas contrôler	Sers les dents	Laisse ton esprit vagabonder	Imagine plus de possibilités pour ce qu'ils disent	Fronce les sourcils	Affirme	Lâche prise	Laisse la conversation t'envelopper	Laisse-toi descendre là	Pose une vraie question
Doute de ce qu'on te dit	Dis ce qui te passe par la tête !	Désaccorde-toi	Envisage le contraire de ce dont tu discutes	Lâche prise	Parle de ce que tu n'as pas	Lâche prise	Considère l'échelle du monde	Raidis ton dos	Oublie ce qu'ils ont dit	Pousse-les plus loin	Incline la tête en arrière	Sois patient	Cède	Balance-toi doucement d'avant en arrière	Ne les regarde pas dans les yeux Si tu le fais, tu commenceras à pleurer	Maintiens l'espace
Ne fais pas confiance à cela	Ne te retiens pas	Parle d'un ton mesuré	Demande "Et si ?"	Détourne-toi	Admire	Fais-leur savoir que tu es heureux d'être ici	Se souvient du COVID-19	Prends ça personnellement	Détache-toi de l'émotion	Clarifie	Recule	Apprécie-les	Accepte	Apaise-toi	Chuchote "s'il te plaît, ne pars pas"	Conserve de l'énergie
Envisage ce qui pourrait mal tourner	Assume tes sentiments	Agrippe fermement les accoudoirs	Secoue la tête	Réfléchis à ton pire souvenir	Regarde-les avec dégoût	Mentionne quelque chose que tu apprécies chez eux	Imagine une chute lente	Imagine leurs mots rebondissant contre ton corps	Détourne le regard	Encourage	Ne les laisse pas trop près	Apprécie ce moment	Affirme ce qu'ils disent	Sens le sol sous toi	Chuchote "j'ai peur de me disperser"	Répète-toi
Inquiète-toi	Acquiesce avec emphase	Sers les doigts	Regarde autour de la pièce	Embrasse la grisaille	Secoue la tête et dis "Ce n'est pas juste"	Les complimente	Dis "je ne sais pas"	Ignore-les	Tape du pied	Anime ton visage	Examine attentivement	Décroise tes bras	Imagine que vous vous rencontrez pour la première fois	Remarque le siège sur lequel tu es assis	Essaie de cacher ton inquiétude	Renforce ta position
Respire rapidement	Maintiens le contact visuel	Raidis ta posture	Laisse la conversation s'estomper en arrière-plan	Mets fin à la conversation	Souhaite avoir ce qu'ils ont	Encourage	Excuse-toi	Distance-toi	Joue une chanson dans ta tête	Questionne	Roule des yeux	Ouvre ton corps	Regarde autour de vous	Regarde-les	Garde tes mains sur tes genoux et regarde-les	Persévère
Continue à regarder derrière toi	Assieds-toi plus droit	Hérisse-toi	Flotte	Interroge le sens de cette conversation	Pense à les tuer s'ils continuent de se vanter	Leur fais confiance	Marmonne	Recule	Fais semblant d'être ailleurs	Continue à demander	Dis "beurk"	Regarde-les	Souris	Regarde autour de toi	Respire superficiellement	Reste ferme dans ta conviction
Fais attention	Détends-toi	Secoue la tête d'incrédulité	Change d'avis à plusieurs reprises	Allonge-toi	Souhaite être eux	Penche-toi en avant	Ne bouge pas d'un pouce	Dis-leur "Sois honnête"	Incline-toi en arrière	Approfondis cela	Dis-leur que tu les vois clairement	Acquiesce	Acquiesce approbativement	Répète un mantra	Chuchote "je ne sais pas de quoi j'ai besoin"	Mets-les au défi
Cherche la sortie	Sens ton corps	Sens ta température monter	Oublie tes mots	Repose ta tête	Dis-leur qu'ils ont juste eu de la chance	Fredonne une chanson dans ta tête	Respire superficiellement	Oublie	Laisse ton esprit vagabonder	Répète ce qu'ils ont dit avec plus d'énergie	Dis-leur que n'importe qui pourrait faire leur travail	Engage-toi	Hausse les épaules et ris	Porte attention à ta respiration	Rappelle-toi d'une autre conversation qui t'a comblé(e)	Arrête d'analyser et dis-leur ce que tu penses vraiment
Ne fais pas attention	Ose	Répète-toi, bruyamment	Ce qu'ils te disent ne semble pas correct	Ralentis ta respiration	Dis "Ce qui monte doit redescendre"	Les remercie d'être ici	Ferme les yeux et secoue la tête	Laisse tomber	Change de sujet	Penche-toi en avant et pousse un cri	Ne sois pas d'accord	Sens ton cœur battre	Dis-leur qu'ils sont intéressants	Ralentis ta respiration	Imagine-toi parler à un bon ami avec lequel tu n'es plus en contact	Dis-leur que tu les comprends et que c'est okay
Évite leur question	Prends quelques respirations rapides mais profondes	Dis-leur, d'une voix ferme, de s'arrêter	Interroge-toi	Inhale sans aucune sensation de satisfaction	Regarde-les	Leur dis que tu as des frissons	Enlace tes genoux	Avale tes sentiments	Demande "comment aimerais-tu que je réponde ?"	Dis-leur, "wow, je ne savais pas ça"	Ignore-les	Sens ta poitrine s'élargir	Demande-leur s'ils aimeraient entendre ton histoire	Dis "je pense que nous tenons quelque chose"	Échoue à ramasser tes morceaux	Demande davantage
Marmonne	Ressens de l'aventure	Fixe-les droit dans les yeux sans jamais détourner ton regard	Perds le fil de tes pensées	Cesse de prêter attention	Fais semblant d'être heureux pour eux	Ris nerveusement	Chuchote "ne fais pas attention à moi"	Dis-leur "tu ne me vois même pas"	Ne leur accorde pas d'attention	Demande-leur, "n'est-ce pas incroyable ?"	Remets en question ce qu'ils disent	Prends-les	Dis-leur que tu comprends	Souris	Cache ton visage	Respire profondément
Dis-leur d'arrêter de t'interroger	Propose une aventure locale	Dis-leur que leur comportement est inacceptable	Regarde-les d'un air sceptique	Ressens la distance entre vous	Insulte-les	Considère si tu es en train de tomber amoureux	Chuchote que tu es désolé	Cache tes cicatrices	Soupire	Prête attention aux nuances de leur voix	Propose une meilleure alternative	Dis-leur que tu es content qu'ils soient venus	Entends ce qui se cache sous les mots	Laisse-les entrer	Refuse de lâcher prise	Dis-leur ce que tu as envie de dire
Demande-leur pourquoi ils sont ici	Oublie les règles	Serre le poing	Pose-leur la question à nouveau	Ne fais aucun effort	Complimente-les avec un faux sourire	Dis "quelle journée !"	Leur dis de rester s'il te plaît	Ferme ton cœur	Réponds à autre chose	Lis entre les lignes aussi	Dis-leur qu'ils se ridiculisent	Ressens leur gravité	Vois ce qu'ils disent avec leur corps	Réchauffe-les	Sombrer	Crois en tout ce que tu dis
Ils posent trop de questions	Dis-leur d'oublier les règles	Serre les dents	Demande-leur qui ils sont	Entends tes propres mots de loin	Ne les aime pas	Les observe	Pense à ce qu'il faudrait pour sauver le monde	Cache ton visage	Dis "peu importe"	Ne dérive jamais	Élargis ta poitrine	Ne détourne pas ton regard d'eux	Prends cela en considération	Accepte-les	Réalise que ce qui est perdu est perdu	Parle comme si tu ouvrais la voie
Évite le sujet	Permets-toi de t'éloigner du sujet	Détruis-les	Oublie où tu es	Réalise que ça ne s'améliorera pas	Fais un effort pour être gentil	Rayonne	Se rappelle que ça va empirer beaucoup avant de s'améliorer	Détourne le regard	Sors ton téléphone	Dis "wow !"	Redresse ton dos	Caresse-les avec ton esprit	Absorbe-les doucement	Laisse tomber ton opinion	Souhaite que les choses soient différentes	Ressens la vérité de ce que tu dis
Ils voient à travers toi	Pousse plus loin	Ils ont tort Tu as raison	Dis "attends une seconde"	Vois comment vos réalités sont séparées	Exagère ce que tu as	Partage	Réalise qu'ils ne parlent pas avec toi	Chuchote qu'ils ne comprennent pas	Demande de quoi ils parlent	Acquiesce intensément	Regarde-les de haut	Dis "tout va bien"	Penche-toi en avant et repose ton menton dans ta main	Ralentis	Tombe à genoux	Admets tes défauts
Prépare-toi à fuir	Danse au rythme de ton battement de cœur	Mordille ton poing	Détourne le regard	Détache-toi	Sache ce que tu mérites	Vois la solution	Ouvre la bouche mais ne trouve pas les mots	Ne leur réponds pas	Dis "euh"	Demande-leur si c'est vraiment vrai	Dis-leur d'écouter	Perds tes mots	Dis-leur que tu es là pour eux	Enlève lentement tes chaussures	Demande pardon	Reconnais leur réalité sans laisser cela affecter la tienne
Acquiesce simplement pour être en sécurité	Ris sans retenue	Lève-toi et crie-leur	Rougis	Affaisse-toi	Force un sourire en écoutant leurs réalisations	Veux que ce moment dure	Serre tes mains fermement	Résiste à l'envie de partir	Dis "je suppose"	Dis-leur que tu n'y avais pas pensé de cette façon auparavant	Pointe du doigt avec ta main	Attire-les doucement	Pense à ce qu'ils ont dit	Ressens avant d'agir	Regrette	Prends le contrôle
Évite la confrontation	Tape dans les mains de quelqu'un à proximité	Dis-leur "Tu ne sais pas ce que j'ai vécu !"	Disparais	Fais semblant de ne pas être là	Jette un regard insatisfait sur tes propres possessions	T'attends à ce que ça devienne encore meilleur	Balance-toi doucement d'avant en arrière	Dis-leur qu'ils devraient s'excuser	Perds le fil	Souris avec enthousiasme sincère	Tape-toi sur la poitrine	Étends-toi vers eux	Interroge-toi à voix haute	Expérimente avant tout	Laisse ta tête retomber sur ta poitrine	Sois comme la gravité
Repense	Partage un rêve sauvage que tu as toujours eu	Dis-leur de se taire	Froisse ton visage d'étonnement	Parle d'une voix sans vie	Mentionne de façon décontractée tes propres réalisations	Claque des mains avec joie	Parle d'une voix monotone et vaincue	Touche la zone où tu ressens une douleur émotionnelle	Ne les écoute pas	Exprime l'étonnement avec des yeux écarquillés	Souris avec condescendance	Ouvre-toi	Ouvre tes bras dans un geste accueillant	Ferme les yeux et profite du moment	Essuie discrètement une larme	Tiens-toi droit avec une posture puissante
Serre les poings	Saute de joie	Crie "Tu n'écoutes pas !"	Parle en énigmes ou en phrases sans sens	Laisse tes phrases s'éteindre dans le silence	Fais semblant de ne pas entendre leurs bonnes nouvelles	Danse spontanément	Laisse tes phrases s'achever dans le silence	Parle avec un tremblement dans ta voix	Oublie ça	Repose ton menton sur tes mains attentivement	Croise tes bras avec désapprobation	Rapproche-toi	Écarte tes doigts largement	Imagine un cadre naturel serein	Serre-toi dans un geste réconfortant	Exprime tes opinions avec une confiance inébranlable
Vérifie tes environs à la recherche de menaces cachées	Fais un compliment sincère à quelqu'un	Dis-leur de s'asseoir	Imite leurs gestes avec confusion	Regarde fixement un point fixe	Compare les événements de ta vie aux leurs	Enlace quelqu'un à proximité	Serre et desserre tes poings	Retiens ton souffle brièvement avant d'expirer lentement	Roule discrètement des yeux	Répète leurs mots en accord	Fais un geste de la main pour signifier le désintérêt	Murmure des mots d'affection	Tourne tes paumes vers le haut	Humme doucement un air apaisant pour toi-même	Laisse ta voix trembler d'émotion	Maintiens un contact visuel avec un sens de l'autorité
Parle à voix basse	Exprime ta gratitude pour le moment présent	Dis-leur de montrer du respect	Mal comprends leurs mots	Réponds par des réponses monosyllabiques	Cache tes propres succès	Exprime ta gratitude pour le moment présent	Regarde dans le lointain avec un regard vide	Grimace ou tressaille à certains mots ou gestes	Réponds "d'accord" avec nonchalance	Exprime la surprise avec une réaction bouche ouverte	Hausse un sourcil avec scepticisme	Exprime l'amour à travers une touche tendre	Maintiens une expression faciale ouverte et invitante	Crée un mouvement de balancement doux	Accorde une pause, comme si tu rassemblais tes pensées	Parle avec un ton ferme et assertif
Hésite avant de faire le moindre mouvement	Applaudis avec enthousiasme	Frappe ta main sur une surface proche	Ferme les yeux et essaie de comprendre	Exprime un manque d'intérêt pour la conversation	Exprime un soupir discret lorsqu'ils parlent de leurs réalisations	Partage une histoire émouvante	Adopte une posture de défaite, les épaules affaissées	Presse ta main contre ton cœur	Parle d'un ton plat et monotone	Montre de la curiosité dans ton langage corporel	Renifle ou fais un son moqueur	Partage un souvenir sincère	Incline ta tête sur le côté avec curiosité	Inspire et expire avec un sentiment de tranquillité	Parle d'un ton doux et vulnérable	Utilise des gestes décisifs et percutants
Fais semblant de ne pas entendre ce qui se dit	Propose un road trip spontané	Fais les cent pas	Incline la tête sur le côté avec perplexité	Exprime de l'apathie envers les projets futurs	Utilise l'humour auto-dépréciatif pour minimiser tes propres forces	Saute de joie	Murmure des paroles de frustration	Laisse tes épaules s'affaisser sous le poids de l'émotion	Vérifie l'heure sans urgence	Réponds avec un intrigué "pas possible !"	Pousse quelqu'un à côté de toi et échange un regard de jugement	Laisse ton regard traîner avec adoration	Invite-les à partager en disant : "je suis là pour écouter"	Laisse ton regard se détendre dans un état méditatif	Touche ton cœur comme si tu ressentais la douleur	Partage une réalisation personnelle avec fierté
Garde ton dos contre le mur	Lance un jeu spontané avec d'autres	Récite une liste de griefs	Parle lentement comme si tu traitais l'information	Réponds avec un soupir lourd	Parle d'un ton passif-agressif	Donne une tape dans la main de quelqu'un avec enthousiasme	Passe tes mains dans tes cheveux avec désespoir	Frotte tes tempes comme si tu essayais de soulager un mal de tête	Manipule un objet machinalement	Exprime la curiosité à travers des expressions faciales	Exhale de manière audible	Tiens leurs mains doucement	Fais un geste de la main ouverte	Visualise une scène méditative dans l'œil de ton esprit	Laisse ton regard devenir lointain et pensif	Visualise une image puissante dans ton esprit
Jette fréquemment un coup d'œil par-dessus ton épaule	Partage un souvenir joyeux	Interromps-les avec frustration	Perds la notion du temps	Fais semblant d'être physiquement fatigué	Roule discrètement des yeux	Exprime l'admiration pour la beauté qui t'entoure	Retire-toi dans un coin ou un espace isolé	Regarde-les avec un mélange de tristesse et de déception	Réponds "bien sûr" d'un ton vague et non engageant	Réponds "dis-m'en plus !"	Parle d'une manière condescendante et patronisante	Souris doucement en pensant à eux	Parle d'un ton doux et accueillant	Fais un geste doux et ouvert de la main	Partage un souvenir sentiment de perte	Utilise un langage affirmatif dans tes réponses
Murmure un secret à toi-même	Prends une grande respiration et crie "je suis vivant(e) !"	Roule des yeux avec exaspération	Humme un air sans queue ni tête	Balance-toi légèrement comme si tu manquais d'énergie	Les complimente mais avec une pointe de sarcasme	Propage des ondes positives avec un compliment sincère	Parle doucement comme si tu avais peur de tes propres mots	Joue avec un morceau de tissu comme un geste réconfortant	Jette un coup d'œil à ton environnement avec désintérêt	Penche légèrement d'un côté avec intérêt	Incline ta tête sur le côté avec une expression moqueuse	Partage un rire sincère ensemble	Partage une expérience personnelle pour créer une connexion	Parle d'un ton calme et mesuré	Réponds "ça me manque" avec mélancolie	Marche avec détermination et assurance
Regarde les autres avec méfiance	Ébouriffe joyeusement les cheveux de quelqu'un	Parle en serrant les dents	Joue avec tes cheveux distraitement	Refuse de faire un contact visuel	Évite de reconnaître leurs accomplissements	Chante une chanson joyeuse à haute voix	Parais physiquement fatigué et épuisé	Parle doucement, presque comme si tu partageais un secret	Offre une réponse d'un mot	Réponds "c'est fascinant !" avec enthousiasme	Utilise un ton moqueur ou sarcastique dans ton discours	Offre un compliment affectueux et sincère	Souris avec une chaleur qui atteint tes yeux	Exprime ta gratitude pour le moment présent	Joue morceau de tissu ou de bijoux distraitement	Parle depuis ton centre avec résonance
Adopte une posture défensive	Pousse un cri de joie	Rejette toute tentative de réconciliation	Exprime ton incrédulité avec un rire sarcastique	Retire-toi lentement de la conversation	Te distraie en regardant quelque chose de brillant	Partage un moment de pur bonheur que tu as vécu	Laisse échapper un profond soupir de résignation	Passe tes doigts le long de toutes les cicatrices physiques que tu pourrais avoir	Exprime un manque d'investissement dans ton langage corporel	Offre un renforcement positif avec des gestes encourageants	Fais semblant de bâiller, impliquant l'ennui ou l'indifférence	Exprime ta gratitude pour leur présence	Permets à ton corps de leur faire face directement	Offre un toucher réconfortant, comme une tape dans le dos	Parle rythme plus lent et plus réfléchi	Exprime tes convictions avec passion
Fais semblant de sourire mais laisse tes yeux révéler la peur	Partage ta chanson préférée et danse dessus	Claque des doigts avec irritation	Cligne des yeux rapidement comme si tu essayais de clarifier tes pensées	Parle lentement	Fais un geste de désintérêt lorsque qu'ils parlent de leurs réussites	Évoque un souvenir préféré qui te fait sourire	Croise tes bras fermement sur ta poitrine	Apparais physiquement épuisé(e) et fatigué(e)	Exhale de manière audible de manière décontractée	Hoche la tête avec un sentiment de compréhension	Regarde tes ongles avec désintérêt	Crée un geste qui signifie l'amour	Utilise un langage inclusif pour favoriser l'ouverture	Partage un souvenir ou une expérience paisible	Laisse tes phrases se perdre dans le silence	Garde tes mouvements délibérés et intentionnels
Déplace nerveusement ton poids d'un pied à l'autre	Fais un compliment sur l'environnement qui t'entoure	Serre la mâchoire	Touche ta tête comme si tu cherchais de la clarté	Utilise un langage vague ou ambigu	Parle de tes difficultés d'une manière qui implique des épreuves	Exprime de l'admiration pour leurs qualités positives	Fais un lent signe de tête en signe de désespoir	Parle par petites phrases hésitantes	Réponds avec un haussement d'épaules nonchalant	Réponds "je n'arrive pas à y croire !"	Fais semblant de vérifier l'heure comme si tu étais impatient	Engage-toi dans une étreinte chaleureuse et persistante	Offre des retours positifs avec un signe de tête encourageant	Crée une ambiance apaisante avec ta voix	Murmure un mot ou une phrase qui résume ta perte	Utilise des mots décisifs dans ton discours
Garde tes mains près de ta poitrine	Exprime ton amour pour la vie	Interromps avec un fort "Ça suffit !"	Jongle avec des pensées contradictoires	Évite de faire des déclarations affirmatives	Réponds à leurs bonnes nouvelles avec un hochement de tête peu enthousiaste	Rayonne d'énergie positive à travers ton langage corporel	Tires sur tes vêtements avec frustration	Ferme les yeux momentanément, comme si tu essayais de chasser la douleur	Laisse échapper un rire peu convaincu	Penche-toi plus près pour montrer ton engagement	Parle par-dessus eux avec un commentaire désobligeant	Parle d'un ton doux et attentionné	Crée un espace physique pour qu'ils puissent s'exprimer	Utilise des mots apaisants et réconfortants	Hoche la tête lentement comme pour reconnaître le poids de l'émotion	Laisse ta voix projeter de l'autorité
Analyse la pièce à la recherche de sorties	Fais un geste audacieux et confiant	Pointe-les du doigt avec accusation	Fais des gestes comme si tu cherchais quelque chose de perdu	Laisse ton langage corporel exprimer la lourdeur	Lutte pour dissimuler tes sentiments de mécontentement	Offre un mot d'encouragement sincère	Réponds avec des réponses vagues et incertaines	Touche tes lèvres comme si tu réfléchissais à ce qu'il faut dire	Parle sans faire de contact visuel direct	Réponds avec une affirmation positive comme "j'adore ça !"	Exagère un soupir d'exaspération	Partage une étreinte réconfortante	Tends la main pour une poignée de main ou un contact amical	Laisse la chaleur de la conversation t'envelopper	Partage un moment de profonde vulnérabilité avec eux	Utilise un langage corporel qui exprime la puissance intérieure
